FilmID	ReviewID	SentenceID	Sentence	Label
10	6	38	uz praktične efekte i cgi, zvučni dizajn je također nešto s čime film može biti ponosan.	0
10	6	39	različiti zvukovi i muzika pojačaju scene i kadrove gdje se nađu, što je veća istina u vezi horor filmova poput aliena.	1
10	6	40	manjak zvuka također igra veliku ulogu u filmu zbog raznih scena u kojima ne bi smjelo biti zvuka.	1
10	6	41	uzmite u obzir da je radnja ipak u svemiru.	1
10	6	42	također, ako niste znali, xenoi, a u filmu specifično facehuggeri, percipiraju svijet pomoću topline i zvuka.	1
10	6	43	tako da ako se mislite šuljati, tišina će vam biti prijatelj.	1
10	6	44	fede alvarez je napisao i režirao ovaj film, te mu je ovo prvi alien na kojemu je radio.	1
10	6	45	izgleda da je dobro proučio materijal koji se našao ispred njega jer svako malo se pojavi nekakav suptilan ili ne toliko suptilan hommage u obliku zvuka ili ponovno iskorištenog dijaloga.	0
10	6	46	također se vidi utjecaj evil dead na kojemu je radio 11 godina prije.	1
10	6	47	sve od mračnijih aspekata filma do muzike koja je u filmu, te mu je ovo definitivno najbolji film koji je napravio do sada.	0
10	6	48	pričajmo malo o slonu u sobi, a to je zadnja trećina filma.	1
10	6	49	iz nekog razloga, jako velika većina filmova ove godine pati od toga kako završiti film.	2
10	6	50	možda će se većini svidjeti kraj koji je romulus dostavio, ali zbog prevelikog fokusa na ostale filmove, ovo samo izgleda poput nekakvog jeftinog pokušaja da se postave još nekakve temelje za sljedeći film ako će ga biti.	3
10	6	51	kao da ih nemamo dovoljno.	2
10	6	52	ali počasti koje ima i koje gledatelji mogu uočiti će ili biti dobrodošli fanovima ili će jednostavno biti previše.	3
10	6	53	rekavši to, sam kraj ima stvorenje koje liči na engineera što postavlja neka druga pitanja za cijelu franšizu.	1
10	6	54	samim time daje počast resurecctionu i njegovoj premisi dok stvara nešto svoje.	0
10	6	55	neke scene i situacije se oslanjaju na napetost i to im dobro ide, ali pred sam kraj, film se osloni na jumpscare što je nepotrebno.	3
10	6	56	nešto malo i o filmovima koji su došli prije romulusa i koji su mu bili uzor.	1
10	6	57	prometej i covenant su jako napredni u tehnologiji.	1
10	6	58	sve je nekako bijelo i svijetlo, dok stariji filmovi i romulus se vraćaju tom nekom sf-u 80tih.	1
10	6	59	prva četri filma su definitivno najviše utjecala na vizualni aspekt romulusa, te mu omogućili da nastane u ovom obliku koji će definitivno najviše obradovati stare fanove.	0
10	6	60	uz razne posvete ostalim alien filmovima, romulus je dašak svježeg zraka koji je bio potreban ovoj franšizi.	0
10	6	61	fede alvarez je bio vrlo dobar odabir za ovaj film, te se vidi da se posvetio ovom filmu kao da je njegovo savršeno stvorenje.	0
10	6	62	sve u svemu, alien: romulus jako puno toga radi dobro, dok određeni aspekti filma pate radi prevelike počasti starijim naslovima.	3
11	1	1	godine 2012. daniel katz, david fenkel i john hodges osnovali su u new yorku filmsku kompaniju a24.	1
11	1	2	vizija osnivača kompanije bila je prilično hrabra s obzirom na navike kino gledatelja.	1
11	1	3	nezavisna filmska kompanija a24 programirana je za niskobudžetne projekte koji su, većinom, drugačiji od blockbusterske kino ponude.	1
11	1	4	dobro osmišljenim reklamnim kampanjama kao i otvorenošću za drugačije projekte, a24 već je u prvim godinama privukao zvučna redateljska imena (sofia coppola, steven knight, denis villeneuve….) i pokazao kako katz, fenkel i hodges misle ozbiljno.	0
11	1	5	kako su godine prolazile tako je i a24 postao sve važniji i utjecajniji filmski igrač (ogroman je broj nagrada koje su filmovi snimljeni pod etiketom spomenute filmske kompanije osvojili – a24 je počeo ostvarivati i respektabilne komercijalne rezultate na svjetskim kino blagajnama).	0
11	1	6	godine 2014. britanski filmaš alex garland snimio je izvrsni redateljski prvijenac upravo za a24 – znanstveno-fantastična drama ex machina potvrdila je garlanda kao vrlo zanimljivog filmaša (prethodno je garland napisao scenarije za filmove “28 dana kasnije”, “sunce”, “dredd.	0
11	1	7	garland je suradnju s a24 nastavio osrednjim “muškarcima” iz 2022. godine – ove godine završen je jedan od najambicioznijih, najprovokativnijih istovremeno i najskuplji film kompanije a24 redatelja i scenarista alexa garlanda.	3
11	1	8	“građanski rat” stigao je u svjetske kino dvorane.	1
11	1	9	radnja filma vodi nas u blisku budućnost – teritorij sad-a poprište je krvavog građanskog rata.	1
11	1	10	predsjednik je, između ostalog, ukinuo fbi i upotrijebio vojno zrakoplovstvo u kojem su stradali civili.	1
11	1	11	floridski savez odnosno zapadne snage teksasa i kalifornije osnovale su vladu i otkazale poslušnost washingtonu – njihove postrojbe približavaju se glavnom gradu – glavni je cilj eliminirati predsjednika.	1
11	1	12	u new yorku se iskusna novinarka, fotoreporterka lee i kolega joel spremaju na put u washington.	1
11	1	13	cilj je razgovarati s predsjednikom i snimiti stanje na terenu.	1
11	1	14	joel i lee kreću na put, ali ne sami – dio njihove ekipe postaje novinarski veteran sammy (njegova je namjera postaviti predsjedniku nekoliko pitanja) i mlada neiskusna jessie.	1
11	1	15	“građanski rat” kombinacija je ratne drame, filma ceste uz dodatak (ratne) akcije.	1
11	1	16	bez obzira na papreno žestoku tematiku, redatelj garland puno je pažnje posvetio vizualnom izričaju koji, između ostalog, bolno i stravično uvjerljivo prikazuje ratna stradanja.	1
11	1	17	uvodne minute prikazuju teroristički napad na civile – novinarske fotografije i kamera svjedoci su masakra, ali i uvod u ono što gledatelja očekuje tijekom čitavog filma.	1
11	1	18	vizualnost je znak raspoznavanja filmova alexa garlanda – “građanski rat” nije iznimka.	1
11	1	19	tijekom filma slika (fotografija) govori više od riječi – ne samo kada je riječ o prikazu ratnih zbivanja već u prikazu duševnog stanja glavnih protagonista odnosno psihičkom pucanju iskusnih novinara koji su (pre)živjeli ratne događaje i svjedoče brutalnom nasilju.	1
11	1	20	putovanje dugo oko 1400 kilometara zapravo je prikaz države rastrgane i masakrirane građanskim ratom.	1
11	1	21	redatelja ne zanimaju uzroci (uzroci su zapravo aktualni odnosno mogu se pronaći u današnjem zapaljivo podijeljenom američkom društvu) već posljedice.	1
11	1	22	u redu, tijekom filma se spominju grijesi američkog predsjednika i opaska jednog od protagonista kako će završiti kao gadafi i ceausescu, ali to je sve – garland ne zauzima stranu, nije ideološki motiviran već prikazuje rat u kojem nema milosti.	1
11	1	23	za zarobljene, ali često i za civile.	1
11	1	24	amerika je eksplodirala i stvari su izmakle kontroli… poput scena iz serije “živi mrtvaci” na cestama kojima novinarska četvorka putuje u washington razbacani su leševi.	1
11	1	25	tijekom putovanja u washington novinarska se četvorka susreće s različitim likovima – naoružani civili koji čuvaju benzinsku postaju, pripadnici vojske, razni lokalni luđaci i paravojne postrojbe koje nitko ne kontrolira.	1
11	1	26	postoje i mjesta čiji se stanovnici ne žele uplitati u sukob, ali i takve su lokacije pod zaštitom.	1
11	1	27	vlada nestašica vode, scena na benzinskoj postaji sugerira kako je američki dolar postao gotovo bezvrijedna valuta, ali ono čega ne nedostaje u niti jednom trenutku je oružje svih vrsta i kalibara.	1
11	1	28	ne samo kada je riječ o vojnim postrojbama – (moderno) oružje posjeduju svi i sada najveći luđaci i psihopate imaju dozvolu za ubijanje.	4
11	1	29	rat je i nema kontrole.	4
11	1	30	rat je i ubijati je poželjno.	4
11	1	31	bez obzira tko je neprijatelj – on se ionako uvijek može pronaći u mirnodopskim vremenima – kako onda neće u ratnim.	4
11	1	32	garland je novi građanski rat u sad-u prikazao iz kuta novinara odnosno fotografa.	1
11	1	33	oni su, povijest ratovanja je pokazala, prvi svjedoci ratnih stradanja i oni koji na licu mjesta razotkrivaju ratna stradanja.	1
11	1	34	odabrana četvorka je lice novinara, spremni su riskirati sve u potrazi za istinom (ili dobrom pričom) ali postoji i naličje koje je garland dotaknuo tijekom emitiranja ratobornih predsjednikovih govora.	1
11	1	35	prikaz ratnih stradanja u filmu alexa garlanda iznimno je realističan, brutalan i nemilosrdan.	1
11	1	36	žestina kojom garland suočava gledatelja s ratom i njegovim posljedicama rijetko se može vidjeti – milosti nema prema protagonistima filma, ali i gledatelj je suočen s brutalnim posljedicama ratnih sukoba.	1
11	1	37	najjezivija scena filma ipak se ne događa na prvoj crti već tijekom puta kada su glavni protagonisti suočeni s lokalnom (para)vojnom formacijom koju predvodi zapovjednik (briljantna izvedba jessea plemonsa).	0
11	1	38	ono što slijedi rijetko se može vidjeti u ponudi kino filmova snimljenih u sad-u.	0
11	1	39	uz spomenutu, briljantno jezivu epizodu jessea plemonsa u vrlo dobrom izdanju su wagner moura, kirsten dunst te cailee spaeny.	0
11	1	40	oni, svaki na svoj način, interpretiraju protagoniste koji su, svaki na svoj način, iako ne nose oružje, sudjeluju i stradaju u sukobu.	1
11	1	41	slojevitost, brutalnost, ali i aktualnost (uz nadu kako nije riječ o proročanskom filmu koji predviđa budućnost) “građanskog rata” nije jednostavno opisati u tek jednoj rečenici.	0
11	1	42	novi film redatelja alexa garlanda subverzivan je, uznemirujući i provokativan film koji prikazuje najmračnije moguće posljedice trenutnog stanja u američkom društvu.	0
11	1	43	za sve koji (površno) tvrde kako se recentna filmska ponuda sastoji isključivo od nastavaka, remakeova i superjunaka, “građanski rat” je izazov.	0
11	1	44	izazov gledanja filma koji je već sada osigurao mjesto među najboljim naslovima 2024. godine.	0
11	2	1	alex garland započeo je karijeru kao književnik sredinom devedesetih kad je napisao roman “the beach” koji će oskarovac danny boyle na početku stoljeća pretvoriti u svoj istoimeni četvrti igrani film, a zatim će dvojac sudjelovati i na boyleovom sljedećem uratku, postapokaliptičnom zombi hororu “28 days later” iz 2002. za koji će garland napisati svoj prvi filmski scenarij i tako definitivno ući u svijet pokretnih slika u kojemu će dvanaest godina kasnije debitirati i kao redatelj hvaljenim znanstveno-fantastičnim filmom “ex machina” koji će čak odnijeti i oscar za najbolje specijalne efekte.	1
11	2	2	nakon toga garland će režirati još dva filma (netflixov “annihilation” iz 2018. i horor triler “men” iz 2022.) te između njih i jednu miniseriju (“devs” za fx 2020.), a sada se vraća sa spekulativno-fantastičnim distopijskim ratnim filmom ceste “civil war” koji je prošli tjedan zasjeo na vrh box officea u američkim kinima kao najuspješnije otvaranje jednog naslova nagrađivane kuće a24 i uglavnom izrazito pozitivnim ocjenama kritike i publike (82 % rotten tomatoes, 75 metacritic, 7,6 imdb), premda ima i onih glasova koji prilično glasno iznose svoje zamjerke, pa se čini da je priča o podijeljenoj americi uvelike podijelila i svoju publiku.	1
11	2	3	garland nas u “civil war” (kojem je kod nas u distribuciji neobjašnjivo dodan i suvišni podnaslov “svakom carstvu dođe kraj”) in medias res, u razjedinjene američke države u kojima se tzv. zapadne snage kalifornije i teksasa (što možda iz naše zvuči kao neobična kombinacija, budući da su ove države trenutno na suprotnim političkim polovima) nalaze u ratu s “lojalističkom” amerikom sa sjedištem u washingtonu, dok na sjeveru djeluje nova narodna armija (koju spominju ikao “maoiste iz portlanda”), a na jugoistoku nešto što se naziva floridskim savezom.	1
11	2	4	garland ne troši vrijeme da nas uputi u povijest ovog sukoba, a svi oni koji taj potez smatraju kukavičkim i traljavim inzistirajući da bi se takvo što trebalo objasniti kao da nisu doživjeli šesti siječnja 2021. i napad razjarene mase na vašingtonski kapitol.	3
11	2	5	ako je klaun poput donalda trumpa bio dovoljan da pokrene takvo što, ne treba puno dvojiti o tome je li građanski rat moguć i izgledan scenarij u sjedinjenim državama kojima bi na vlasti bio autokrat dovoljno sposoban da fašizam koji ključa ispod površine doista i provede u djelo.	4
11	2	6	u slučaju “civil wara”, to je očito predsjednik kojeg glumi nick offerman, a koji u uvodnim sekundama filma vježba obraćanje naciji u vrlo trampovskom demagoškom stilu najavljujući pobjedu svoje strane koju “mnogi nazivaju najvećom pobjedom u vojnoj povijesti”.	1
11	2	7	naravno, uskoro ćemo vidjeti da je istina gotovo oprečna toj izjavi, ali govorimo u svijetu u kojemu istina više nema vrijednost.	2
11	2	8	drugim riječima, svijetu prema kakvome sve ubrzanije srljamo posljednjih godina.	2
11	2	9	kakvu ulogu u takvom svijetu imaju mediji?	1
11	2	10	to je jedno od glavnih pitanja koje se provlači kroz garlandov film u kojemu je u središtu pozornosti skupina novinara na putu prema prijestolnici prema kojoj jurišaju zapadne sile.	1
11	2	11	lee smith (kirsten dunst) je fotografkinja za reuters, a joel (brazilski glumac wagner moura najpoznatiji po ulozi pabla escobara u netflixovoj seriji “narcos”) njezin kolega koji pristaje na put povesti i njihovog ostarjelog prijatelja sammyja (stephen mckinley henderson) iz “onog što je ostalo od new york timesa” i mladu jessie (cailee spaeny, poznata po naslovnoj ulozi u “priscilla” sofije coppole) koja se želi baviti ratnom fotografijom kao njezin uzor, naša lee.	1
11	2	12	ova četvorka probija se kroz postapokaliptični američki krajolik koji uvelike podsjeća na onaj kakav je garland oslikao u svom scenariju za “28 days later”.	1
11	2	13	osim zvjerskog nasilja na svakom koraku, jednako je jezovit i osjećaj nesigurnosti koji izaziva česta nemogućnost raspoznavanja zaraćenih strana na bojištu, a pritom su česte i paravojne skupine koje često djeluju kao da ne pripadaju niti jednoj strani, već vrše vlastiti teror nad stanovništvom.	2
11	2	14	garland ni ovdje ne troši puno vremena za objašnjavanje situacije, budući da prikazuje sukob koji traje toliko dugo (znamo da je predsjednik odradio barem tri mandata dosad) da bi razglabanje likova o tome predstavljalo pretjeranu ekspoziciju koja bi samo štetila narativu, a i narušila spomenutu atmosferu nesigurnosti koja filmu daje izrazito realističan i stravičan ton.	1
11	2	15	ovo je posebno prisutno u jednoj od ključnih epizoda filma u kojoj junake ispituje vođa jednog odreda ubojica koji očito istrjebljuju pripadnike drugih rasa, a kojeg nezaboravno tumači jesse plemons s nadrealnim crvenim sunčanim naočalama.	1
11	2	16	kad ga novinari mole za milost inzistirajući da su amerikanci, on odgovara: “da, ali kakvi amerikanci?” na to pitanje ne postoji točan odgovor, budui da je na snazi bratoubilački rat, a ni sami junaci ne znaju kome pripada čovjek čiji je odred u njih uperio puške.	1
11	2	17	da je ovo još samo jedan film o sukobu “dobrih i zlih”, ovaj efekt ne bi mogao biti postignut.	1
11	2	18	da, u garlandov distopiji nema moralno jasnih kontura, pa čak ni kod likova koji su u žarištu priče.	1
11	2	19	oni su novinari koji ganjaju vijesti ne obazirući se pretjerano na zvjerstva, krv i umiranje koji se zbivaju oko njih.	3
11	2	20	oni neutralno prenose zbivanja na frontu i to ih hrani, napaljuje i daje im osjećaj da su živi.	1
11	2	21	premda neki tumače da film govori o važnosti novinarstva, “civil war” ipak postavlja pitanja o novinarskoj etici i neutralnosti i nemilosrdnom škljocanju fotoaparata koji se nalaze usred vojnih akcija, kao i o ovisćnosti o adrenalinu koji eksplozije i nasilje u njima proizvode.	1
11	2	22	ni na ovom polju garland, srećom, ne drži moralne prodike, već prepušta gledateljima da sami donesu svoju ocjenu profesije u ekstremnom dobu.	0
11	2	23	“civil war” jedan je od najboljih prikaza rata koje smo već dugo imali prilike gledati na filmu.	0
11	2	24	ovo nije rat u nekim dalekim džunglama i pustinjama, nego američkoj publici “na domaćem terenu” i dio tamošnjih prigovora vjerojatno se može svesti na to da amerikanci imaju osjećaj da im tamo neki stranci (u ovom slučaju britanac) drže prodike o njihovom društvu.	1
11	2	25	ali dobar dio strave u filmu proizlazi iz činjenice da je scenarij koji prikazuje sasvim moguć, pa možda čak i izgledan u ne tako dalekoj budućnosti.	0
11	2	26	i upravo zato djeluje realniji od prikaza stvarnih ratova koji se događaju daleko od očiju, daleko od srca.	0
11	2	27	ovo nije što bi bilo kad bi bilo, ovo je što će biti ako nastavimo u istom smjeru podjele društva u razne crvene i plave tabore.	1
11	2	28	pitajmo se koliko je potrebno da ratovi prestanu biti kulturni i napokon se izvadi oružje.	4
11	3	1	čini se da je danas američko društvo najpolariziranije još od 1860-ih kada je bjesnio američki građanski rat.	1
11	3	2	kad su nakon predsjedničkih izbora 6. siječnja 2021. trumpovi pristaše upali na kapitol, to se zloguko prizivalo kao potencijalni početak širih sukoba, možda i novog građanskog rata.	1
11	3	3	i iako se situacija na sreću smirila, teško je povjerovati da se sva netrpeljivost jednostavno izgladila.	1
11	3	4	prije da je zatomljena.	1
11	3	5	američko društvo duboko je podijeljeno, a juriš na kapitol bio je samo konkretan izraz nečega što se kuha već dugo vremena, i što bi moglo ponovno proključati, recimo na nadolazećim predsjedničkim izborima, ako se ne uhvati ukoštac sa strukturnim razlozima sukoba.	1
11	3	6	no kako će trump opet biti republikanski kandidat, možemo očekivati sve suprotno od pozitivne i smirene kampanje.	4
11	3	7	u tom je kontekstu „građanski rat“, podnaslovljen sa „svakom carstvu dođe kraj“, tempiran vrlo spretno.	0
11	3	8	i unatoč nazivu s jasnim povijesnim aluzijama, film ostaje prilično apolitičan u smislu da ne oslikava ni jednu današnju političku struju.	1
11	3	9	na primjer, kada se u jednoj sceni prikaže karta saveznika, vidimo kako su kalifornija i teksas u istoj alijansi.	1
11	3	10	ne znam kakav bi se sulud tijek događaja u stvarnosti trebao odviti da se takvo što dogodi.	4
11	3	11	s obzirom na to da ne znamo pravi uzrok građanskog rata (izuzev povremenih natruha kao što je predsjednikov treći mandat), film ostaje izvan konkretne političke situacije, što mu omogućuje da bude univerzalniji i tako bolje ostari.	0
11	3	12	svi veliki filmovi i knjige koje su postali klasici uspjele su upravo to – oduprle se zubu vremena, uspjele su da njihove poruke imaju smisla van samih konteksta u kojima su nastale, upravo zato jer se mogu primijeniti na šire zakonitosti ljudskog društva.	4
11	3	13	jedna takva knjiga (ili film, ako ste gledali ekranizaciju) svakako je “1984”.	4
11	3	14	nastala je u vrijeme hladnoratovske blokovske podjele, ali u njoj su artikulirane velike, bezvremenske ideje koje nepobitno nadilaze vrijeme svoga nastanka.	4
11	3	15	univerzalna poruka u slučaju “građanskog rata” je više-manje “rat je pakao”.	4
11	3	16	problem je što u ovom slučaju ona nije prenesena najuvjerljivije.	2
11	3	17	općenito, antiratna ideja da je rat pakao snažna je dokle god se rat odvija daleko, po mogućnosti na drugom kontinentu.	1
11	3	18	tada se najbolje svi ideali i razlozi za rat mogu učiniti besmisleni, svesti se na čisti kaos i divljaštvo.	1
11	3	19	možemo se u miru zgražati nad ludostima zaraćenih strana.	4
11	3	20	e, ali kada na domaćem terenu sukob postane dovoljno izgledan, onda više nećemo biti toliko ravnodušni.	4
11	3	21	onda će ludosti postati vrijednosti, a divljaštvo preživljavanje.	4
11	3	22	sve će odjednom postati duboko smisleno, a sve te priče koje izjednačavaju suprotstavljene strane izgledat će gotovo uvredljivo.	4
11	3	23	ponajviše zbog činjenice da je neizmjerno licemjerno reći da su ideali za koje ljudi stradavaju lažni.	1
11	3	24	naravno, nije da nema antiratnih filmova koja tematiziraju ludost rata.	1
11	3	25	upravo suprotno.	1
11	3	26	ali takva tema zahtjeva jedan finiji, nijansiraniji, a možda i upečatljiviji pristup.	2
11	3	27	zanimljivo je da je unatoč nazivu “građanski rat” u filmu više potencirana uloga novinara i medija u ratnim vremenima.	1
11	3	28	radnja prati završne dane građanskog rata, u kojima fotoreporterka lee (koju je utjelovila kirsten dunst) zajedno s novinarom joelom (wagner moura) i sammyjem (stephen mckinley henderson), pokušava doći do washingtona prije nego što ga pobjednička strana osvoji.	1
11	3	29	cilj im je intervjuirati i fotografirati predsjednika u završnim trenucima vlasti.	1
11	3	30	na put im se priključuje i mlada jessie (cailee spaeny), koja teži postati fotoreporterka, baš kao i lee.	1
11	3	31	praktički možemo govoriti o filmu ceste jer se čitava radnja odvija tijekom putovanja koje prate brojne prepreke i opasni susreti.	1
11	3	32	na početku se jessie teško nosi sa stresovima kojima se ratni fotografi izlažu (obješeni ljudi, unakrsna vatra, gubitak svake humanosti), ali ostaje pri sebi zahvaljujući trezvenošću lee koja je na taj način puni snagom.	1
11	3	33	ipak, bez obzira na vanjsku smirenost, vidimo koliko su razni ratovi ostavili ožiljaka na lee, i koliko se ona teško nosi sa mučnim slikama kojima je svjedočila kao fotograf.	1
11	3	34	lee i jessie zapravo funkcioniraju kao antipodi, ili još bolje: oprečni stadiji iste osobe.	1
11	3	35	subverzivni potencijal fotografije prikazuje se kroz jessie, koja nastoji dokumentirati sve ratne strahote i tako poslati poruku za budućnost.	1
11	3	36	lee je vjerojatno bila ista takva u mladosti, ali s vremenom je izgubila vjeru u moć fotografije.	1
11	3	37	kako ratna fotografija može imati ikakav utjecaj kada se isti onaj užas na kojeg je upozoravala svojim slikama sada odvija u njenoj vlastitoj zemlji?	2
11	3	38	uzrok toga vjerojatno je isti onaj na kojeg sam se osvrnuo na početku osvrta.	1
11	3	39	dakako, nije da ratna fotografija nema utjecaja (vrlo je poznat primjer gole djevojčice u vijetnamu koji je doveo do velikog vala antiratnih prosvjeda), ali ratna fotografija pokazana u obliku kakav je u “građanskom ratu” lišena je bilo kakve supstance i smisla te umjesto toga svedena na bezglavu trku za što dramatičnijim prizorom kako bi se objavila na naslovnici.	3
11	3	40	na takvoj fotografiji ljudima je oduzeta ljudskost, a fotografi postaju paparazzi koji riskiraju vlastitu glavu za pet minuta slave.	2
11	3	41	posebno je potresna pri tome završna scena, ali vjerujem da je bolje da je sami vidite.	1
11	3	42	je li garland imao takvu koncepciju fotografije kad je stvarao film teško je sa sigurnošći reći, ali s obzirom na to da je prikazano kako su lee i jessie slične, onda je i implicirano da će se jessie s vremenom neminovno razočarati u fotografiju i moć medija.	1
11	3	43	a takav pogled na medije ne ostavlja prostora za bilo kakav potencijal fotografije da pokaže istinu, a kamoli da ljude natjera da promijene trenutne postavke koje su i dovele do takvog užasa.	2
11	3	44	film je inače produciran od a24, produkcijske kuće čiji filmovi često izvrću žanrovske odrednice, što ovdje ipak nije bio slučaj.	1
11	3	45	ostaje osjećaj da je film htio biti i više od zabave, kao da je htio reći nešto dublje, i k tome došao opasno blizu, a onda zastao.	3
11	3	46	to ne znači da je film bio loš, dapače, riječ je o vrlo gledljivom i napetom filmu, koji vam neće dati predaha do samog kraja jer jednom kad krene, onda zaista krene.	3
11	3	47	sam koncept filma ceste, u kojem na svakoj postaji čeka nova situacija, miče prazni hod i čini da se film od tek 109 minuta čini dužim (u pozitivnom smislu).	0
11	3	48	osim toga, film je vizualno zaista prelijep (izuzev povremeno previše naglašenog bokeha (način fotografiranja u kojemu je izoštren samo objekt, a pozadina zamućena, op.a.), ali to je bio umjetnički izbor i stvar ukusa).	0
11	3	49	posebno je impresivan završni upad na washington, kulminacija filma sa širokim sukobom u kojem frcaju ekspolozije, tenkovi harače, rafali rešetaju.	0
11	3	50	inače nisam fan masovnih scena borbe, ali u ovom slučaju je režirana fantastično, s izmjenama između šireg prikaza konflikta i fokusa na likovima koji pokušavaju izvući živu glavu.	0
11	3	51	“građanskom ratu” pomogla je i vrlo kvalitetna postava koju je predvodila kirsten dunst.	0
11	3	52	odglumila je izmučenu fotorepoterku krajnje uvjerljivo, bez trunke glamura ili preneamaganja.	0
11	3	53	lijepo je vidjeti da se uspješno prebacila u drugačiji tip uloga od onih kakve su je krasile na početku karijere.	0
11	3	54	tu je i wagner moura koji se internacionalno proslavio ulogom pabla escobara u seriji “narcos”.	1
11	3	55	ovdje se odlično snašao i ponudio jednako dobru izvedbu kao i kirsten dunst.	0
11	3	56	a bit će i zanimljivo vidjeti kako će se razvijati karijera cailee spaeny.	1
11	3	57	na temelju prikazanog, moglo bi biti nešto i od nje.	0
11	3	58	zaključno, bez obzira što sam na početku rekao štošta o tome kako nije riječ o pretjerano snažnom ratnom filmu, treba općenito pohvaliti film.	3
11	3	59	nedostatke pokriva zanimljivom i napetom pričom koja će vas držati zainteresiranima do kraja.	3
11	3	60	a i s vizualne strane je gotovo besprijekoran, prepun vrlo lijepih kadrova i fotografski posloženih scena.	0
11	3	61	bila bi šteta da je ikako drugačije s obzirom da se unatoč svemu radi o filmu o fotografiji i mogućnosti zahvaćanja istine, više nego ratu.	0
