FilmID	ReviewID	SentenceID	Sentence	Label
26	2	15	trenutku u kojem ćete ili reagirati ili šutjeti, trenutku koji će vam odrediti ostatak života koji ćete provesti ili kao junak ili kao kukavica.	1
26	2	16	a s prebacivanjem fokusa s dragana na tomu, slijepčević uspijeva natjerati gledatelja da se zapita koji bi od dvojice muškaraca bio, ali implikacije ovog pitanja su daleko šire ako ste uistinu iskreni prema sebi.	1
26	2	17	možda jest centralni lik svoje životne priče, ali ne i junak.	1
26	2	18	"nije ovo tip scene kakve već gomilu puta nismo vidjeli u filmovima u kojima se junaci napokon nađu na ""testu života"", ali istinita pozadina osjetno povećava uloge i cijeloj epizodi daje posebnu težinu, jer život ima naviku iznenada vas staviti u situacije koje će na površinu izvući ""ono od čega ste stvoreni""."	1
26	2	19	i vlak je ovdje savršen temelj za bezbroj više ili manje uspješnih doskočica.	1
26	2	20	"ili ćete reagirati odmah ili ""proš'o voz"", ali još bitnije, baš kao i vlak u ovoj priči, nakon vaše odluke život nastavlja dalje, a vi sa sobom vučete prtljagu svojih odluka."	4
26	2	21	sve ove fore i forice na stranu, slijepčević je snimio briljantan kratki film koji zaslužuje sve pohvale i nagrade koje je osvojio i koje će tek osvojiti.	0
26	3	1	dostojanstveno, veličanstveno… herojski, ponosno… pridjevi su koji ponajčešće odjekuju u javnom (ustvari, zapravo, medijskom) diskursu na ovim prostorima.	0
26	3	2	naravno, vezani su uz domoljubni zanos i osjećaj.	4
26	3	3	istime prevladava permanentna egzaltacija (pobjedničkim) „lijepim našim“ naspram (pobijeđenog) njihovog.	1
26	3	4	kroz ovaj se trijumfalizam kao doživljaj svijeta, zapravo, provlači užas.	1
26	3	5	tako, npr. walter benjamin – u svojim čuvenim tezama o filozofiji povijesti – apostrofira „veličanstvene, herojske“, trijumfalne povorke kao nositelje „kulturnih dobara“.	1
26	3	6	međutim, užas u pogledu na te povorke predstavljaju poniženi, pobijeđeni, ubijeni, pregaženi… sve one nevine žrtve koje bivaju zaboravljenima u toj egzaltaciji.	1
26	3	7	štoviše, benjamin kazuje i da je „(znak) filozofije povijesti kao pobjede – fašizam“.	1
26	3	8	imamo li mi današnji uopće sposobnost shvatiti ovo?	4
26	3	9	jedan od umjetničkih pokušaja dohvaćanja usuda tog zaboravljenog čojstva i, nadasve, hrabrosti, svakako je i kratkometražni igrani film nebojše slijepčevića, čovjek koji nije mogao šutjeti (2024).	1
26	3	10	svjedočanstvo je to o stvarnome događaju.	1
26	3	11	naime, na željezničkoj stanici u štrpcima, u veljači 1993., ubijeno je dvadeset osoba, ne-srpske nacionalnosti.	1
26	3	12	izdvojeni su iz putničkog vlaka i pogubljeni.	1
26	3	13	i to samo zato što s bili muslimani/bošnjaci… ne-srbi.	1
26	3	14	užas je to koji ne smijemo zaboraviti.	1
26	3	15	slijepčević – ponajvećma dosad poznat kao vrstan dokumentarist – odlučio je ovu storiju evocirati u formi igranog, kratkog metra.	1
26	3	16	njegov je odabir teme, zapravo, samo nastavak osobnog mu pregnuća na „kulturi sjećanja“.	1
26	3	17	možda najzapaženiji dosadašnji takav mu film, svakako je bila srbenka (2018), film o pripremi kazališne predstave olivera frljića, a koja se bavi slučajem ubojstva zagrebačke obitelji zec.	1
26	3	18	file rouge između ovog filma i čovjeka, naravno, ubojstvo je iz niskih, „šovinističko-nacionalističkih“ (premda je primjerena i riječ: fašistoidnih) pobuda.	1
26	3	19	obično se kazuje kako narodi koji se ne znaju suočiti s ovakvim zločinima, počinjenim u njihovo ime – nemaju budućnost.	1
26	3	20	(ili se vrte kroz circulus vitiosus „loše beskonačnosti“, kako bi to spekulativno odredio hegel).	1
26	3	21	poduhvaćanje umjetničkog suočavanja s tim bolnim, neuralgičnim točkama, međutim, dokazuje da i u hrvatskoj imamo autore koji nastoje potaknuti mentalizaciju i empatiju.	1
26	3	22	no, kako je slijepčević filmski, dakle, umjetnički progovorio o istini?	1
26	3	23	može li se kroz njegov kratkometražni uradak zamijetiti univerzalna ideja o opstojećoj humanosti?	1
26	3	24	pozvaniji od mene govoriti o tomu, već su izrekli svoj sud.	1
26	3	25	siguran sam da ne postoji iole upućeniji filmofil u hrvatskoj i regiji koji nije saznanjen o nagradama što ih je čovjek koji nije mogao šutjeti polučio od najuglednijih europskih filmskih žirija.	1
26	3	26	no, kako stvari s time stoje u hrvatskoj?	1
26	3	27	zemlji koju je film reprezentirao?	1
26	3	28	može li se ona, zbiljski (wirklich) prepoznati u univerzalnosti poruke ovoga filma?	1
26	3	29	tema ovog napisa, dakle, nastoji stvar zahvatiti dublje od analize kulturartefakta, tj. uobičajene filmske kritike.	1
26	3	30	(za autora ovih redaka, to je i jedino smisleno.)	4
26	3	31	no, krenimo ipak od filmskih momenata cijelog ovog „slučaja“.	1
26	3	32	mutna, zatamnjena vizura pogleda na kupe u vlaku, otvara film.	1
26	3	33	pred nama se polako razotkriva njegov (naoko!) protagonist dragan (goran bogdan).	1
26	3	34	iz usnulosti, prene ga zaustavljanje vlaka.	1
26	3	35	svi suputnici iz njegovog kupea, naravno, bivaju uznemireniji nego inače.	1
26	3	36	jer… ratna su vremena.	1
26	3	37	fokusiranjem kamere na njihova lica, stvara se „strepnja“.	1
26	3	38	ponajvećma se to vidi kod mladića milana (silvio mumelaš) koji sjedi nasuprot.	1
26	3	39	no, uplašen je i djed s unučicom (dušan gojić, priska ugrina), a iz ostalih kupea, kao i izvana čuju se povici.	1
26	3	40	dolaze vojnici, zapravo soldateska koja legitimira putnike…	1
26	3	41	sve ovo uvod je u najvažniji dramatski moment filma.	1
26	3	42	slijepčević nas navodi pomisliti da će prestrašeni mladić bez dokumenata biti okidačem mogućeg nasilja.	1
26	3	43	no, umijećem narativnog preokreta, heroj filmske storije postat će čovjek kojeg do tog trenutka u filmu uopće nismo zamjećivali.	1
26	3	44	umirovljeni oficir jugoslavenske vojske tomo (dragan mićanović) odlučno će se suprotstaviti verbalnom nasilju što ga nad ostalim putnicima u kupeu vrši vojnik soldateske rs-a (alexi manenti).	1
26	3	45	iako bi po svim pravilima (ne-ljudske!) običajnosti i vojnim regulama, tomo trebao ostati pošteđen, vlak će nastaviti putovanje bez njega, a kamera se zakratko fokusira na mjesto na kojem je do dolaska ratnih zločinaca dotični mirno sjedio.	1
26	3	46	ostaje praznina…	1
26	3	47	kako tumačiti ovu „prazninu“?	1
26	3	48	ponajvećma, radi se o ispražnjenom prostoru (samo)svjesnog subjekta.	1
26	3	49	odnosno, o onome što je najčešće „prazno“.	1
26	3	50	jer, malo je ljudi koji doista čuvaju ljudsko dostojanstvo kada je ono ustrašeno, ili u ovome slučaju dovedeno pred ultimativnu nelagodu ugroženosti vlastite egzistencije.	1
26	3	51	ljudi radije šute o ugrozi koja se nadvija nad drugima, ako sami osjećaju da će šutnjom izbjeći tu ugrozu.	1
26	3	52	to je ultimativna „etička ograda“, koja nam najčešće zaprječuje samu etičnost.	1
26	3	53	kantovo „treba da“ (sollen) najčešće ustukne pred hrabrim djelovanjem kada ono u sebi uključuje rizik da se iz lagodne, moralizirajuće pozicije upusti u stvarnu djelatnost prakse dobre volje kao umnog htijenja.	1
26	3	54	čemu ovdje politizacija, odnosno filozofiranje?	4
26	3	55	upravo stoga što jedino uz samu „stvar mišljenja“ možemo doprijeti do poante čovjeka koji nije mogao šutjeti.	1
26	3	56	spoznaja egzistencijalne ugroze generira – strah.	1
26	3	57	jedino odlučno djelovanje iz načela suosjećanja s drugim, može poroditi – čovjeka.	1
26	3	58	o tome doista pripovijeda slijepčevićev, diljem europe nagrađivani film.	1
26	3	59	ima li ovaj čovjek iz naslova filma nacionalnost?	1
26	3	60	pripada li on pobjedničkoj strani u proteklome ratu?	1
26	3	61	konačno, je li njegov čin, tek akt ludila, ili se radi o nečem drugom?	1
26	3	62	kako se isti, uopće, uklapa u trijumfalne nacionalne narative s ovih prostora?	1
26	3	63	u hrvatskoj, nazovi „javnosti“, mnogi su društveno-mrežni komentari išli u diskreditaciju autorskog stava/ideje.	4
26	3	64	naime, kako može pripadnik zloglasne jna, tomo buzov biti predstavljen „herojem“?	4
26	3	65	i kako da tu u hr-filmu nema „lijepih naših“ junaka?	4
26	3	66	namah ovako izvučeni, stereotipi pravovjernog trijumfalističkog nacional-diskursa, govore o dubokoj traumi koju su po hr-bitak izazvala zbivanja proteklog rata.	1
26	3	67	jer… zna se tko je agresor, a tko žrtva… nemaj drugih priča o toj svetoj dogmi.	4
26	3	68	naravno, mi smo pobijedili, oni su poraženi.	4
26	3	69	a gdje je tu čovjek?	1
26	3	70	onaj koji govori parezijastički (foucault) istinu u lice nasilniku, pa makar ga to stajalo i vlastita života!	4
26	3	71	odavno je sahranjen u masovnu grobnicu neznanih, poniženih, pregaženih, ubijenih, mučenih iz benjaminova poimanja svjetske povijesti kao pobjede.	1
26	3	72	a mi ovdašnji, sada i ovom trenutku?	1
26	3	73	iako legitimno abolirani „pobjedom u ratu“, vrtimo se u „kulturi laži“, poodavno detektiranoj po dubravki ugrešić.	1
26	3	74	dotad tomo buzov (1940.-1993.), čovjek koji nije mogao šutjeti nebojše slijepčevića, nažalost, ostaje tek munchov bezglasni – krik.	1
27	1	1	za američkog glumca anthonyja perkinsa ne može se reći ili napisati kako je one movie wonder.	1
27	1	2	nastupio je perkins u sedamdesetak filmova i serija tijekom karijere koja je trajala gotovo četiri desetljeća.	1
28	1	3	ipak, za većinu ljubitelja filma prva asocijacija na perkinsa je interpretacija psihotičnog normana batesa u jednom od najboljih filmova (konkurencija je ovdje iznimno jaka) majstora napetosti alfreda hitchcocka.	1
28	1	4	perkins je jezivo uvjerljiv u ulozi čovjeka koji…vodi motel i neće dopustiti nikome remećenja odnosa između njega i pokojne majke.	1
28	1	5	“psiho” je, također, ostao poznat i zbog scene pod tušem – i danas ona izgleda šokantno iako je od premijere “psiha” prošlo nešto manje od 65 godina…	1
28	1	6	koja je poveznica između perkinsa i triler/horora “sakupljač duša”, filma koji je vrlo dobrim rezultatima na kino blagajnama i, većinom, kritičarskih pohvala postao film o kojem se govori?	1
28	1	7	prva je veza oz perkins – sin pokojnog anthonyja koji je prema vlastitom scenariju snimio film.	1
28	1	8	druga je poveznica šokantna i jeziva priča filma – baš kao i ona kada je o “psihu” riječ.	1
28	1	9	ne, ne – nije “sakupljač duša” novi “psiho” niti je u rangu spomenutog filma, ali je riječ o brutalnom filmu koji će mnoge gledatelje šokirati – baš kao što je scena pod tušem ili pronalazak mame bates šokiralo gledatelje davne 1960. godine…	1
28	1	10	nakon kratkog uvoda (koji je važan za film, ali tek tamo pred završetak otkriva se značaj uvodnih scena) upoznajemo intuitivnu i, na detalje osjetljivu agenticu fbi-ja lee harker.	1
28	1	11	harker postaje suradnica na slučaju serijskog ubojice koji je desetljećima neuhvatljiv za policiju i fbi.	1
28	1	12	meta ubojice poznatog pod nadimkom dugonogi su obitelji – na mjestima zločina istražitelji pronalaze šifrirane poruke s potpisom dugonogog.	1
28	1	13	no, istražitelji nikako ne mogu ući u trag dugonogom – jedan od najvažnijih razloga je činjenica kako (izuzetak su spomenute poruke) nema dokaza kako je dugonogi u trenucima ubojstava bio u domovima stradalih…	1
28	1	14	desetak milijuna dolara budžeta, film “sakupljač duša” svrstava u relativno male filmove kada je o novcu riječ – u prvom je vikendu prikazivanja u američkim kinima vratio uloženo i zaradio desetak milijuna dolara.	1
28	1	15	manji budžet redatelju i scenaristu uopće ne smeta – gledateljima koji većinom gledaju visokobudžetne blockbustere, “sakupljač duša” u trenucima će biti neobičan i drugačiji za gledanje međutim već od prvih minuta radnja i način na koji je film snimljen čvrsto će zgrabiti gledateljice i gledatelje i neće ih pustiti sve do završnih scena filma.	0
28	1	16	koristeći neugodnu glazbu te nagle i iznenadne rezove, skrivajući izgled dugonogog do, otprilike, polovice filma te poigravajući se s gledateljevim strpljenjem i percepcijom, perkins, unatoč brutalnim scenama zadržava gledateljevu pažnju i znatiželju.	0
28	1	17	brutalno, krvavo i šokantno, ali ipak….tjera na gledanje.	1
28	1	18	da, pomalo kontradiktorno, ali u slučaju “sakupljača duša” potpuno funkcionalno i očekivano.	1
28	1	19	gledatelj je suočen sa žestokim nasiljem (kakav drugačije film o serijskom ubojici može biti?), neizvjesnošću i nelagodom (o radnji filma sigurno će biti polemika i različitih razmišljanja – naravno, filmu se može prigovoriti nekoliko, ha, propusta), ali redatelj vrlo vješto plete priču i gledatelj će izdržati sve kako bi saznao istinu.	4
28	1	20	istinu o zločinima, istinu o ubojici (ili ubojicama), ali i istinu o agentici harker.	1
28	1	21	žrtve serijskog ubojice su članovi obitelji.	1
28	1	22	obitelj kao institucija i stup društva u krizi je posljednjih godina pa i desetljeća.	1
28	1	23	na zidovima ureda policijske stanice često se i vrlo napadno ističu uramljene fotografije bivšeg predsjednika clintona…koje poruke redatelj šalje?	4
28	1	24	tko je kriv za krizu obitelji?	1
28	1	25	zašto clinton?	1
28	1	26	takvi i slični detalji neke će gledatelje pozvati na raspravu dok neki u njima i neće vidjeti nešto pretjerano važno…	3
28	1	27	iako se “sakupljač duša” ne može nazvati kopijom nekog filma iz prošlosti, redateljevi uzori su vidljivi tijekom gledanja filma (“zodiac”, “kad jaganjci utihnu”, “sedam” čak i “psiho”).	1
28	1	28	glumačka ekipa je vrlo dobro odabrana – predvode je maika monroe i nicolas cage.	0
28	1	29	maika monroe vrlo dobro interpretira inteligentnu i pronicljivu agenticu harker.	0
28	1	30	koliko je dobra, ne dobra nego odlična, u poslu toliko je lee harker izgubljena u privatnom životu i komunikaciji izvan ureda.	1
28	1	31	kako minute filma odmiču postaje sve jasnije zašto je agentica harker izgubljena u svijetu koji ne pripada istragama i zločinima.	1
28	1	32	od nicolasa cagea doživjeli smo svašta u njegovoj glumačkoj karijeri, ali u ovakvom izdanju glumca još vidjeli nismo.	3
28	1	33	nekima će nastup cagea u “sakupljaču duša” biti loš, nekom dobar, ali vjerojatno neće biti gledatelja koji će osporiti kako je cage jezivo uvjerljiv i manijakalan u ulozi dugonogog.	3
28	1	34	dakle, ispunio je očekivanja s obzirom na priču i ambicije filma..	0
28	1	35	“sakupljač duša” je jezivi, krvavi horor/triler koji nema milosti prema žrtvama ubojice, ali milost ne daje niti gledateljima i gledateljicama.	1
28	1	36	nervozan, tjeskoban i duboko mračan film koji ne nudi grama optimizma, ali, bez obzira na sve navedeno, gledatelj neće odustati.	1
28	1	37	znatiželja za otkrivanjem istine je prejaka ne samo u životu nego i kada je o filmu riječ.	1
28	1	38	jedan od takvih filmova je i “sakupljač duša”….	1
28	2	1	"distribucijska i producentska kuća neon odradila je gerilsku marketinšku kampanju za film ""sakupljač duša"" s trailerom koji je uznemirujuć, a pri tome nije dao nikakve naznake o sadržaju, što je zapravo bio dobar potez."	1
28	2	2	glorificirala se dijabolična uloga nicolasa cagea u neprepoznatljivom izdanju.	1
28	2	3	uskoro su se pojavili i napisi u tisku kako je riječ o najstrašnijem hororu ove godine ili čak desetljeća i sl.	1
28	2	4	"problem je u tome što je ""sakupljač duša"" više sjajan, a manje strašan film."	3
28	2	5	dobio se krivi dojam.	3
28	2	6	marketinška kampanja je u kina privukla publiku zainteresiranu da vide što je tu tako strašno.	1
28	2	7	a u usporedbi s grozomornim, sadističkim slasher hororima gdje se nižu mesarska ubojstva eksplicitnih prizora bez nekog opipljivog smisla, ovo malo majstorsko djelo, u degutantnosti egzekucija njima jednostavno ne može konkurirati.	3
28	2	8	riječ je o pametnom uratku jezovitog ugođaja koji bi, da nema natprirodnih elemenata bio sjajni psihološki triler.	3
28	2	9	s druge strane, promotivna kampanja je natjerala veliki broj gledatelja u kina pa je gledajući iz te pozicije gerilska kampanja urodila plodom.	3
28	2	10	film je po svom originalnom scenariju režirao osgood perkins, čovjek zavidnog pedigrea.	1
28	2	11	"naime otac mu je slavni anthony perkins (""psycho""), a majka glumica i fotografkinja berry berenson."	1
28	2	12	nesretno je skončala kada se 11. 9. 2001. vraćala s odmora iz massatchusettsa u los angeles i to baš onim avionom koji se namjerno zaletio u sjeverni toranj world trade centera u new york cityju.	1
28	2	13	i to nije sve.	1
28	2	14	"osgoodova teta marisa berenson je glumila u takvim klasicima poput viscontijeve ""smrti u veneciji"", fosseova ""cabareta"" i kubrickova ""barry lyndona""."	1
28	2	15	"lista njegovih slavnih rođaka se doima beskrajnom, od modnih dizajnerica pa do znanstvenika, no još samo valja spomenuti njegova brata elvisa osgooda, jer je pod pseudonimom zilgi napisao izvornu glazbu za ""sakupljača duša""."	1
28	2	16	junakinja filma je fbi agentica koja posjeduje ekstrasenzorne sposobnosti te je zbog toga angažirana za bizarni slučaj istrage o seriji ubojstava.	1
28	2	17	shema je uvijek ista; u obiteljskim kućama otac brutalno ubije svoju obitelj, a nakon toga izvrši samoubojstvo.	1
28	2	18	i premda nema dokaza da je netko fizički bio u blizini, na prizorištu ubojstava agenti nalaze šifrirane poruke osobe koja sebe naziva longlegs.	1
28	2	19	perkinsov scenarij naizgled vrvi klišejima.	3
28	2	20	tu imamo s*ebanu agenticu ekstrasensa, skeptične kolege, opterećujuće repove iz prošlosti, ponavljanje sheme i motiva s tri šestice, sotonizam, ekstravagantnog negativca, brutalna ubojstva u krugu obitelji itd., ali su ti klišeji tako dobro posloženi da rezultiraju uzbudljivom, napetom i najzad originalnom filmskom tvorevinom.	3
28	2	21	režijski i snimateljski film je briljantan.	0
28	2	22	dio kadrova je snimljen iz donjeg rakursa što pridonosi klaustrofobičnom ugođaju.	1
28	2	23	eksterijeri su pusti, bez ljudi, u magli i tami s protagonistima koji kao da su sami na svijetu.	1
28	2	24	"vremenom radnje smještenom u devedesete godine prošlog stoljeća, perkins ukazuje na svoje filmske reference, a to su demmeov ""kad jaganjci utihnu"" i fincherov ""sedam""."	1
28	2	25	"i zaista, ""sakupljač duša"" s navedenim djelima ima zajedničkih dodirnih točaka, prvenstveno zbog karizmatičnog i fatalističkog odnosa istražitelja i ubojice, no perkins u tu shemu uvodi nadnaravni element."	1
28	2	26	to mi se čini kao najslabija karika filma, posebno zato jer je pojam sotone već otprije zadan kao ultimativno zlo, a za tim nije bilo potrebe, jer je lik lutkara u izvedbi nicolasa cagea dovoljno dijaboličan i ledi krv u žilama, premda su mu perkins, a naravno i cage, paradoksalno dodali i komični element.	2
28	2	27	također problem predstavlja i lik agentice s ekstrasenzornim moćima.	2
28	2	28	naime ona je zbog njih i angažirana u istrazi, ali se ta njezina sposobnost kako teče radnja više ne spominje i na kraju postaje potpuno nevažna.	2
28	2	29	šteta, jer je u toj činjenici bilo dosta potencijala.	2
28	2	30	no vrline filma svakako pretežu nad njegovim manama.	3
28	2	31	perkins se u plašenju i šokiranju gledatelja ne koristi jeftinim trikovima, poput onih starih fora s prozorima i ogledalima.	1
28	2	32	osim same zastrašujuće fabule, tome pridonose dizajn zvuka, subliminalni zvukovi i poruke koje ne čujemo, ali nam djeluju na podsvijest pa o svemu razmišljamo dugo vremena nakon što smo napustili kino dvoranu.	1
28	2	33	tu je i sugestibilna glazba koja vas potrese poput struje.	1
28	2	34	glumačke role su besprijekorne, uz već spomenutog nicolasa cagea, briljira i kiernan shipka u maloj, ali važnoj ulozi.	0
28	2	35	maika monroe je kao glavni protagonist agentice fbi-ja iznijela film na svojim plećima, ali joj je usfalilo malo živosti, no valjda je tako trebalo biti.	3
28	2	36	valja spomenuti i još jedan aspekt ovog vrlo dobrog filma: rock'n'roll, točnije rečeno glam rock.	0
28	2	37	naime film započinje citatom, ne biblijskim ili filozofskim, nego ni manje ni više nego citatom autora marca bolana, gitariste i pjevača grupe t.rex.	1
28	2	38	u biti t.rex i nisu bili demokratska grupa, nego marc bolan i prateći glazbenici.	1
28	2	39	"citat je iz slavne hedonističke pjesme ""get it on"" iz 1971. godine."	1
28	2	40	nakon citata slijedi najavna špica.	1
28	2	41	"opet je riječ o t.rexima i pjesmi ""jewel"" s nastupnog albuma grupe."	1
28	2	42	također u lutkarskom ateljeu glavnog negativca se na zidu jasno vidi plakat s likom marca bolana.	1
28	2	43	"a i odjavna špica je ozvučena s ""get it on""."	1
28	2	44	otkud kod perkinsa takva opsesija t.rexima?	1
28	2	45	tijekom pisanja scenarija je stalno slušao grupu, a prilikom telefonskog razgovora s nicolasom cageom mu je to napomenuo.	1
28	2	46	"cage se iznenadio, jer je svog sina dan prije učio svirati gitaru svirajući bizarni solo pjesme ""cosmic dancer"", pogađate t.rexa."	1
28	2	47	ta čudna podudarnost je perkinsa motivirala da t.rexe ubaci kao lajtmotiv svog filma.	1
28	2	48	"nadalje, kostimografija i blijeda šminka cageova lika sugerira da je njegov protagonist možda bio glam rock glazbenik koji se zbog neuspjeha glazbene karijere okrenuo sotoni, što je čest motiv u mitologiji rock glazbe, posebno kod starih blues majstora poput roberta johnsona i njegove mitske pjesme ""crossroads""."	1
28	2	49	"bijela boja premazana preko lica cageova lika je izravna referenca na boba dylana i njegovu sablasno bijelu maskaru kakvu je nanosio na lice tijekom njegove slavne ""rolling thunder"" turneje iz sredine sedamdesetih."	1
28	2	50	opsesija bijelom maskarom i glam rockom tu ne prestaje.	1
28	2	51	"naime u agentičinoj kući na zidu je zalijepljen plakat lou reeda s njegovog albuma ""transformer"" gdje se jasno vidi reedovo bijelo našminkano lice."	1
28	2	52	"ako vam sve gore navedeno, uz taj ""poseban"" misleading (krivo navođenje, op.u.) trailer filma nije dovoljno da film odete pogledati, onda je za vas samo ljetna no brainer (pitka, op.u.) komedija ili crtić."	4
28	3	1	psihološki horor-triler sakupljač duša je film u kojem je gotovo svaki kadar prava noćna mora.	1
28	3	2	redatelj osgood perkins kreirao je zlokoban, atmosferičan i mračan film koji naprosto hipnotizira gledatelje.	1
28	3	3	glavne uloge, u ovom filmu koji će dugo ostati u vašim mislima, tumače izvanredna maika monroe te nicolas cage, u izdanju u kakvom ga još niste vidjeli.	0
28	3	4	film sakupljač duša (longlegs, 2024.) jedan je od filmova o kojem se u posljednje vrijeme najviše priča.	1
28	3	5	iza njega stoji scenarist i redatelj osgood perkins.	1
28	3	6	vjerojatno već i ptice na grani znaju da je on sin legendarnog glumca anthonyja perkinsa (preminuo 1992,),  koji je širokoj filmskoj publici najpoznatiji po ulozi normana batesa u svevremenskom klasiku slavnog redatelja alfreda hitchcocka psiho (psycho, 1960.).	1
28	3	7	osgood perkins svoju filmsku karijeru započeo je kao glumac i to u ulozi mladog normana batesa u filmu psiho ii (psycho ii, 1983.).	1
28	3	8	do sada je naredao dvadesetak uloga a mogli smo ga vidjeti i u filmovima zvjezdane staze (star trek, 2009.) i nikako (nope, 2022.).	1
28	3	9	kao scenarist i redatelj debitirao je filmom february (2015.) a često se hvali njegov film marica i ivica (gretel & hansel, 2020.).	1
28	3	10	sakupljač duša njegov je četrti igrani film (a treći koji je snimio po vlastitom scenariju).	1
28	3	11	harker se počinje baviti slučajem i stvari se napokon pomaknu s mjesta.	1
28	3	12	uskoro otkrije i obrasce unutar ovih ubojstava koje njezin šef, agent carter (blair underwood) i ostatak tima nikada nisu primijetili.	1
28	3	13	no, ovaj slučaj vuče ju sve dublje i dublje, u doslovni i figurativni pakao iz kojeg mora pobjeći prije nego što se krvoproliće ponovno dogodi.	1
28	3	14	film sakupljač duša snimljen je za manje od 10 milijuna dolara te pripada redu tzv. low-budget filmova.	1
28	3	15	no, u nepuna dva tjedna na kino blagajnama zaradio je gotovo 50 milijuna dolara.	1
28	3	16	razloga za to je puno a jedan od glavnih je jedinstvena filmska naracija redatelj osgooda perkinsa.	1
28	3	17	ta njegova naracija vidljiva je već na samom početku filma – pratimo flashback uokviren kao da gledate nečiji kućni film kroz projektor u obiteljskoj sobi.	1
28	3	18	automobil se zaustavlja, iz zabačene kuće izlazi mlada djevojčica.	1
28	3	19	perkins odmah kreće s poigravanjem s perspektivom.	1
28	3	20	tim poigravanjem naprosto ‘zaključava’ gledatelja u taj okvir ali mu i daje pogled na susret koji će utjecati na sve što dalje u filmu slijedi.	1
28	3	21	također, on se vizualno često koristi naglim i neočekivanim rezovima a sve to začinio je prilično neugodnom glazbom.	1
28	3	22	njegov film na trenutke poprima i obrise art filma te eksperimentalnog filma.	1
28	3	23	ti obrisi ne odbijaju gledatelja već ga dodatno privlače za nastavak gledanja.	1
28	3	24	simbolizam kao alat za strah	1
28	3	25	perkinsov film nigdje ne žuri što je opet samo pojačava njegovu kreaciju zlokobnog, atmosferičnog i mračnog film koji naprosto hipnotizira gledatelje.	1
28	3	26	dodatno, dio perkinsove inspiracije za film nedvojbeno se krije i u stvarnom događaju o serijskom ubojici u sad, zvanom zodiac, koji je već spomenuti redatelj fincher ekranizirao u istoimenom filmu 2007. godine.	1
28	3	27	perkins je inače kao redatelj poznat po vizualno bogatim hororima punim simbolike.	1
28	3	28	od toga nije odustao niti u sakupljaču duša.	1
28	3	29	u njemu se dosta bavi sotonističkom simbolikom, koje su savršeni za vrijeme i okruženje u kojem se film dešava.	1
