FilmID	ReviewID	SentenceID	Sentence	Label
16	2	49	deseti film u serijalu sadrži već poznate lude akcijske sekvence koje apsolutno krše sva moguća pravila fizike i logike, ali ipak nisu na nivou onih iz prošlih filmova.	2
16	2	50	novi zlikovac, dante, je okej dodatak serijalu, ali uglavnom odaje utisak neprijatnosti kad god je na ekranu, čak iako ga glumi beskonačno karizmatični jason momoa.	3
16	2	51	drugi novi likovi su samo tu da zamjene likove koji su umrli ili one koji igraju poznatiji i skuplji glumci.	2
16	2	52	povratak starih faca za koje smo mislili da nećemo nikada vidjeti obećava veći utisak finalnosti u narednim filmovima, te se čekaju oni da najzad završe ovaj serijal i samim tim okončaju karijeru vin diesel-a.	4
16	3	1	svaki put kad zaključavam vrata i odlazim u kino gledati neki od filmova za koje unaprijed znam da će biti grozni, pitam se što sam samome sebi skrivio, otkud taj mazohizam i za koje grijehe prošlosti točno odrađujem tu pokoru.	4
16	3	2	na koncu ni ne napišem ništa o tim filmovima, jer pljuvati je lako, od tog nitko nema koristi i to samo hrani moju zločestu stranu koju se trudim držati pod kontrolom.	4
16	3	3	sjetio sam se svoje profesorice i jučer kad sam na izlasku zaključavao vrata i bio sam prilično siguran da će se taj iscrpljujući scenarij ponoviti.	4
16	3	4	kad neka franšiza ima deset nastavaka, samo budala može očekivati da će se nešto promijeniti i sa sigurnošću unaprijed znaš jesi li ciljana publika za taj film ili nisi.	4
16	3	5	akcija je bila premlaka da nadoknadi sve ono prazno moraliziranje i pseudomudrosti o životnim vrijednostima i obitelji koje kao da su prepisane s manje nadahnute boce jane.	2
16	3	6	neki su povraćali u kinu kad su prije 50 godina gledali “the exorcist”, ali meni je ovo mnogo gore.	4
16	3	7	unatoč tome, bilo je u serijalu i neporecivo uzbudljivih scena koje ćemo dugo pamtiti kao neke od najodvažnijih u žanru, poput primjerice nezaboravnog iskakanja iz zrakoplova u automobilima koje smo vidjeli u sedmom nastavku.	0
16	3	8	te i takve sekvence ponekad bi bile dovoljne da izdržimo breme strašne gnjavaže koje prati ove filmove.	3
16	3	9	bilo je teško naslijepo reći hoće li ih biti u desetom nastavku, ali donekle ohrabrujući je faktor ležao u činjenici da režiju po prvi put u serijalu potpisuje louis leterrier koji se već koliko-toliko osvjedočio u žanru visokooktanske akcije.	3
16	3	10	promjene po pitanju ispraznih i ljigavih dijaloga naravno nema, štoviše još su gori i neprestano vrijeđaju inteligenciju gledatelja.	2
16	3	11	kao scenaristi su potpisani dan mazeau i prethodni redatelj justin lin, ali teško ćete me uvjeriti da film nije zapravo napisala umjetna inteligencija sa smjernicama da ih prilagodi organskoj neinteligenciji.	2
16	3	12	svaka scena počinje s prepričavanjem dotadašnje radnje kao da svi patimo od alzheimera, a akcijske scene te često motivacija likova uvjerljivi su kao da gledamo kakav crtani film.	2
16	3	13	mnogi su crtani filmovi puno ozbiljniji od “fast x”, ali to i nije nepremostiv problem.	4
16	3	14	trebate se prepustiti i uživati u odvažnoj blesavosti ovog filma i naći ćete u njemu taman toliko zabave da možda nećete zaista požaliti što ste ga gledali.	3
16	3	15	naravno, neke stvari ćete nedvojbeno požaliti, kao činjenicu da ste još jednom dva sata bili prisiljeni gledati vina diesela, daleko najgoreg glumca među aktualnim holivudskim zvijezdama, hodajući krumpir u usporedbi s kojim i keanu reeves doseže brandovske visine.	2
16	3	16	u “fast x” i dalje samo širi krindž dok glumi emocije duboke ljubavi prema svojoj obitelji i radi ozbiljne macho face dok vozi nabrijane aute.	2
16	3	17	osim crtićke akcije koja u nekoliko navrata bude doista upečatljiva, jedan od glavnih iskupljujućih elemenata je najbolji negativac cijelog serijala dante reyes kojeg s vidnim užitkom igra jason momoa.	3
16	3	18	njegovo ludilo graniči s onim jokera u izvedbi jacka nicholsona, poremećen je i otkačen i unatoč jadnom scenariju uspijeva uvijek biti zabavan i privlačan kao klaun luđi i od samog filma u kojem se nalazi.	0
16	3	19	sve ostalo u filmu toliko je van pameti da se uopće ne morate truditi pratiti što se točno zbiva i to logički povezati.	2
16	3	20	u desetom nastavku scenaristi odlučili su vratiti valjda sve likove iz dosadašnjeg serijala ponovno u igru, pa su tako čak i neki mrtvi ponovno oživjeli.	4
16	3	21	svi su jedni drugima u rodu, a i oni koji nisu su „obitelj“.	1
16	3	22	mnogi koji su prije bili negativci sad su postali pozitivci, a neki negativci postanu dobri da bi se ipak na kraju ispostavilo da su ipak zapravo loši.	4
16	3	23	tu vam neće pomoći ni već spomenuto konstantno prepričavanje radnje jer to ni sami autori valjda nisu znali objasniti pa ubaciti u film.	4
16	3	24	potrebno je doista potpuno isključiti mozak.	2
16	3	25	radnja desetke se nadovezuje na onu iz petog nastavka serijala koji se naširoko smatra najboljim, ali možda nije ni potrebno da pamtite što se točno u njemu dogodilo jer će ta priča ionako biti prilagođena kako bi odgovarala narativu ovog nastavka, pa je zapravo čak i bolje da i to zaboravite.	4
16	3	26	budite tabula rasa, ponesite nešto protiv mučnine, opustite se i zamislite da ste blesavi.	4
16	3	27	možda vam to bude dovoljno.	4
16	3	28	ako nije, onda ste definitivno prezahtjevna publika za ovaj film, što je potpuno legitimno i ne trebate se nikome zbog toga ispričavati.	4
16	3	29	u “fast & furious” ionako sve treba biti veće i jače nego u svim ostalim serijalima, pa će oni finale provući kroz čak tri filma, tako da se moramo pitati jesmo li upravo gledali nekakav završetak ili pak početak nove trilogije i koliko je zlatnih jaja potrebno da više dobijemo taj omlet i zahvalimo se svima na skromno nutritivnoj večeri.	4
16	4	1	nevjerojatna je činjenica kako je serijal koji je započeo davne 2001. godine preživio do današnjih dana.	1
16	4	2	u redu, ponuda iz hollywooda godinama je, pa i desetljećima ispunjena nastavcima, ali doći do desetog filma nije jednostavno.	1
16	4	3	posebno kada se nastavci nižu kao na traci bez posebnih zanimljivosti kada je o radnji riječ.	2
16	4	4	tamo od četvrtog i petog filma autori filmova donose nove likove i sve luđe, bizarnije akcijske vratolomije koje su odavno postale važnije od protagonista i radnje.	4
16	4	5	pojavio se u serijalu tenk, podmornica – u devetom filmu neki su protagonisti završili u svemiru.	1
16	4	6	bučne i histerične, (pre)duge i, na kraju priče, zamorne akcijske scene postale su jedan od najsnažnijih zaštitnih znakova serijala koji je ponekad izgledao kao da je parodija, samog sebe.	2
16	4	7	deseti film je stigao, ali ništa se promijenilo nije.	2
16	4	8	toretto i ekipa ponovo jure velikom brzinom i promiču obiteljske vrijednosti.	4
16	4	9	radnja filma povezana je petim filmom serijala iz 2011. godine.	1
16	4	10	toretto i ekipa eliminirali su šefa brazilskog narko kartela hernana reyesa.	1
16	4	11	svjedok reyesova ubojstva bio je i njegov sin.	1
16	4	12	dvanaest je godina reyes mlađi simboličnog imena dante smišljao osvetu za smrt oca.	1
16	4	13	nakon više od desetljeća dante kreće u osvetnički pohod – meta su dominic toretto, njegova obitelj i prijatelji.	1
16	4	14	ogromnih 340 milijuna dolara uloženo je u deseti film serijala – naravno, tradicija akcijskih ludorija morala je biti nastavljena.	4
16	4	15	glavni negativac koji kontrolira ostale negativce ucjenama kao glavnu metu ima toretta, ali, onako usput, ruši sve pred sobom.	4
16	4	16	nije problem – akcijske ludorije bez smisla kada je o radnji film riječ, postale su zaštitni znak serijala, ali one su ponovo preduge, zamorne, histerične, u trenucima zbog nervozne kamere i teško gledljive.	2
16	4	17	u redu, filmovi “brzi i žestoki” serijala nikada nisu imali ambicije ispričati smislenu priču.	2
16	4	18	deseti film serijala najbolje dokazuje kako je ionako sve podređeno rušenju i destrukciji.	2
16	4	19	protagonisti se, često, pojavljuju i odjavljuju iz priče bez ikakvog smisla.	2
16	4	20	kao što raste broj uništenih automobila tako raste i broj likova koji se pojavljuju u filmu.	4
16	4	21	većina njih je povezana obiteljskim vezama – poput neke sapunice nije jednostavno pratiti sve veze i poznanstva.	4
16	4	22	važnost obitelji spominje se nebrojeno puta u filmu – ništa protiv obitelji, upravo suprotno, ali slične rečenice slušamo već od početka serijala.	4
16	4	23	ambicija ekipe filma je, vjerojatno, ostaviti što snažniji dojam kada toretto ili netko njemu blizak izgovara epske rečenice o obitelji.	4
16	4	24	koliko deseti film serijala može proći kao dobra kino zabava?	1
16	4	25	ne baš – o akcijskim trenucima, histeričnoj destrukciji koja bombardira oči i uši i radnji napisano je u prethodnim rečenicama.	2
16	4	26	bez obzira koliko protagonisti pokušavaju nasmijati gledatelja razloga za smijeh gotovo i nema.	2
16	4	27	u više od dva sata filma ima tek dva-tri trenutka koji uspijevaju izmamiti osmijeh.	2
16	4	28	deseti film serijala ima novog negativca – dante reyes histerični je i sadistički osvetnik koji je oduševio dio američke kritike, ali i publike.	0
16	4	29	reyes odnosno momoa u velikoj mjeri kopira jokera, ali negativac nije veći od filma.	2
16	4	30	momoina izvedba često je prenaglašena, iritantna.	2
16	4	31	možda je pisac ovih redaka, poput murtaugha iz “smrtonosnog oružja“, too old for this shit , ali teško se oteti dojmu kako svaki novi nastavak serijala “brzi i žestoki” sve više podcjenjuje gledatelja odnosno posjetitelja kino dvorane.	2
16	4	32	još jedan film bez smisla, bučan i destruktivan – za brzi zaborav.	2
17	1	1	prvi susret s kultnom stolnom igrom dungeons and dragons ostao mi je u izvrsnom sjećanju.	0
17	1	2	premda sam duži niz godina bio upoznat s kulturološkom bombom zvanom tamnice i zmajevi, moje znanje o igri svodilo se isključivo na reference u popularnoj kulturi, posebice u filmovima i serijama.	1
17	1	3	s vremenom je znatiželja konačno nadvladala strah te sam se spletom okolnosti našao za stolom, usred vlastite avanture u fantastičnom svijetu dnd-a.	1
17	1	4	vrlo brzo shvatio sam zašto je dnd jedna od najpopularnijih stolnih igara svih vremena, s impresivnom bazom od 13 milijuna aktivnih igrača.	0
17	1	5	količinu slobode i neobuzdane mašte koju sam znao doživjeti za vrijeme prosječnih partija teško je opisati riječima.	0
17	1	6	bajkoviti svijet dnd-a ispunjen je zmajevima, čarobnjacima, dvorcima, goblinima i drugim fantastičnim motivima preuzetih iz najrazličitijih izvora; od narodnih i antičkih mitologija preko j.r.r. tolkiena pa sve do biblije.	0
17	1	7	ako ovome pridodamo raznoliku postavu kompleksnih likova koje mogu preuzeti igrači i upotpunimo to s bezvremenskim narativom epske pustolovine koje se krije u svakoj sesiji, dobili smo recept za ultimativno fantasy iskustvo.	0
17	1	8	unatoč popularnosti i dubokom bunaru mogućih fabula koji bi bili idealni za ekranizaciju, tamnice i zmajevi nisu se proslavili na filmskom platnu.	3
17	1	9	štoviše, jedina adaptacija vrijedna spomena je istoimena animirana serija nastala ranih osamdesetih godina prošlog stoljeća.	1
17	1	10	ruku na srce, postoji i igrani film snimljen 2000. godine, no riječ je o ispodprosječnom ispljuvku koji ne zaslužuje vašu pažnju.	2
17	1	11	s obzirom na neslavnu prošlost serijala, vijest o novoj adaptaciji dočekao sam s priličnom dozom skeptičnosti, a moje sumnje dodatno su se povećale jednom kada su počeli izlaziti traileri.	2
17	1	12	film mi je izgledao poput prožvakane, bezdušne verzije fantastičnih avantura pojačan s generičnom formulom marvelovih filmova.	2
17	1	13	srećom, mračna predviđanja bila su tek djelomično točna.	3
17	1	14	iako se dungeons and dragons: honor among thieves uistinu neprekidno služi takozvanom marvelovom formulom, radi to na prikladnim mjestima i s nemalom količinom šarma, zbog čega me na kraju više podsjetio na solidne izlete poput čuvara galaksije, a manje na posljednji antman.	3
17	1	15	radnja filma prati lopova i putujućeg svirača edgina.	1
17	1	16	nemoralan način bogaćenja rezultirao je obiteljskom tragedijom i smrti edginove supruge, zbog čega on i njegova družina pristaju na rizičnu krađu strogo čuvanog blaga.	1
17	1	17	pljačka u ključnom trenutku pođe po krivu, a banda se neslavno raspada.	1
17	1	18	nakon nemilog događaja edgin vrijeme provodi u zatočeništvu, a jedina osoba koja je ostala uz njega je vječno namrgođena barbarka holga.	1
17	1	19	dvojac planira bijeg iz zatvora, ponajprije kako bi se edgin ponovno sjedinio s kćeri kirom.	1
17	1	20	ubrzo nakon bijega saznaju kako je brigu o kiri preuzeo forge, sitni prevarant i bivši član družine koji se nekako domogao pozicije poglavara u prosperitetnom gradu neverwinteru.	1
17	1	21	kako bi se domogao svoje kćeri, edgin će morati sastaviti tim spretnih i sposobnih pojedinaca koji će mu izvojevati pobjedu i sprovesti njegove ingeniozne taktičke zamisli.	1
17	1	22	osim obiteljske drame u neverwinteru, edgin i družina uplest će se u sukob s mračnim i moćnim crvenim čarobnjacima iz zemlje thay koji žele preuzeti kontrolu nad svijetom.	1
17	1	23	ako vam se pri spomenu pojmova poput thay, neverwinter ili bard ne javlja poriv za bacanjem kockica, ne morate brinuti – struktura filma u potpunosti je pravocrtna i radnju ćete razumjeti i ako nikada u životu niste odigrali tamnice i zmajeve.	1
17	1	24	slične niti vodilje koje su marvelov svijet učinile lako probavljivim širokom krugu ljudi prisutne su i u časti lopova.	1
17	1	25	najjednostavnije rečeno, scenarij se sastoji od brojnih zakulisnih referenci na poznate segmente iz igre koje će cijeniti obožavatelji, no istovremeno je i vrlo dobrohotan i prohodan novopridošlicama u ovaj svijet – zmaj sit, koze na broju!	0
17	1	26	narativne dionice akcije, priče, razrade likova i humora u stopu prate formulu modernih stripovskih filmova, a utjecaj je tolik da sam u nekim dijelovima borbe doslovce vidio identičnu koreografiju kao kod jednog marvelovog ostvarenja.	1
17	1	27	u filmu su korišteni praktični i specijalni efekti koji uglavnom otkrivaju kako je ovdje riječ o visokobudžetnom naslovu.	1
17	1	28	kada bih bio zlopamtilo, rekao bih da se mjestimično u pozadini mogu vidjeti mutni dijelovi nekih kompjutersko dočaranih kulisa, no riječ je o sitnicama.	3
17	1	29	čast lopova u mnogočemu djeluje kao blast from the past naslov koji je najbolje promatrati kao vrckavu i lepršavu zabavu.	3
17	1	30	svjestan sam da se neprestano ponavljam, no ne mogu naglasiti koliko me čast lopova podsjetila na onaj stari marvel, prije no što je isti postao izlizan i samodostatan.	0
17	1	31	kroz nešto više od dva sata čast lopova provest će vas kroz vrtuljak na kojem će vas neprestano zasipati humor, akcijske sekvence i domišljate izmjene replika šarolike glumačke postave.	0
17	1	32	naravno, u pozadini svega krije se obiteljska priča o poštenju, obitelji i onim pravim vrijednostima koje nadilaze materijalno, no trenuci u kojima film želi da ga shvatite ozbiljno razbacani su samo u ključnim dijelovima radnje.	1
17	1	33	ako tražite zabavan film fantastične tematike uz koji se možete opustiti i gdjekad dobro nasmijati, tamnice i zmajevi: čast lopova rado će vam ispuniti prazninu.	0
17	1	34	no, ako ste željni zabavnog naslova koji se ne libi nasmijati vas na nekonvencionalne načine, pritom zaobilazeći dobro uhodane formule, čast lopova djelovat će vam kao prilično slabašan zbroj pa vam preporučujem da svoje kocke bacite negdje drugdje.	2
17	2	1	dungeons & dragons je role playing game koji već pola stoljeća ljudi svih generacija igraju na sessionima diljem svijeta, a tkogod je ikad imao sreće zaigrati u dobroj ekipi pod kvalitetnim vodstvom iskusnog dungeon mastera zna da nema videoigre koja se može mjeriti s kampanjom za koju nije potrebno više od nekoliko priručnika, set neobičnih kocaka i bujna mašta sviju uključenih.	1
17	2	2	isto tako, jasno je da toliko popularna igra ima veliku publiku i da bi kvalitetna filmska ekranizacija privukla mnoštvo gledatelja, no nažalost takvo što se u povijesti nije uspjelo ostvariti.	2
17	2	3	ima tog intelektualnog vlasništva koje i u ovo vrijeme u kojem su ekranizacije stripova postale glavnim izvorom zarade na kinoblagajnama nikako ne polazi za rukom postići očekivani uspjeh.	1
17	2	4	tu treba ubrojiti i “dungeons & dragons”, koncept koji se neslužbeno i službeno pokušava prebaciti na veliki ekran još od osamdesetih, premda se s razlogom rijetko tko još sjeća naslova poput “mazes and monsters” s vrlo mladim tomom hanksom u jednoj od glavnih uloga iz 1982., ili da je “krull” objavljen godinu dana kasnije s također mladim liamom neesonom bio spominjan kao sadržaj vezan za popularnu igru.	1
17	2	5	službena adaptacija se pojavila 2000. godine, a nisu je ni približno mogla spasiti zvjezdana imena iz glumačke postave kao što su jeremy irons, marlon wayans i thora birch.	2
17	2	6	očekivanja su tako bila u najmanju ruku ograničena kada je najavljeno da stiže još jedan reboot franšize.	2
17	2	7	za početak treba reći da je “dungeons & dragons: honor among thieves” postigao ono što nije bilo teško i postao daleko najkvalitetnijom ekranizacijom d&d-a svih vremena.	0
17	2	8	više od toga, riječ je o izuzetno zabavnom ostvarenju koje će zadovoljiti fanove igre, ali će jednako zabaviti svakoga tko za nju možda i nije čuo, jer poveznice nisu uopće krute ni presudne za praćenje radnje.	0
17	2	9	nadalje, film je zasjeo na vrh američkog box officea srušivši prošlotjednog osvajača johna wicka i zaradivši 37 milijuna dolara u prvom vikendu prikazivanja na domaćem terenu, što je udvostručeno u ostatku svijeta.	1
17	2	10	ipak, te brojke čine tek polovicu budžeta filma i pitanje je hoće li ukupna zarada biti dovoljna da franšiza napokon zaživi.	3
17	2	11	film prati barda edgina, bivšeg člana pravedničke skupine harfista kojeg nesretne prilike prisile na život krađe i pustolovine.	1
17	2	12	prati ga njegova prijateljica, barbarska ratnica holga kilgore s kojom na početku filma bježi iz zatvora da bi saznao kako njegova kći kira živi pod obmanom njihovog bivšeg kolege forgea fitzwilliama.	1
17	2	13	edgin i holga okupljaju vlastitu skupinu avanturista dodajući svojim redovima još jednog bivšeg suradnika, nesigurnog čarobnjaka simona i druidicu doric, a svoje usluge će im ustupiti i paladin xenk.	1
17	2	14	ova skupina mora proći niz questova kako bi oslobodila kiru, pokušala vratiti u život edginovu suprugu, osvetila se forgeu, ali i zaustavila njegovu partnericu sofinu, opasnu čarobnicu koja ima mnogo mračnije i opasnije planove.	1
17	2	15	ono što slijedi niz je uzbudljivih pustolovinama u kojima se skupina bori protiv raznih neprijatelja, te konstantno mora smišljati alternativne planove kako da uspije u svojim kompliciranim nakanama.	1
17	2	16	autori filma ne ostavljaju mnogo predaha i uvijek iznalaze nove opsjenarske trikove kojima maskiraju činjenicu da je okosnica priče prilično tanka za film čije trajanje doseže 140 minuta.	3
17	2	17	naravno da stvaranje jednog takvog svijeta uključuje mnogo cgi-ja, ali čini se da je ovaj u ponekim scenama kombiniram i sa praktičnim efektima, a ta kombinacija se pokazuje mnogo uspješnijom nego kad je sve prepušteno računalima.	0
17	2	18	pitanje je hoće li na blagajnama zaraditi dovoljno da opravdaju ulaganje u potencijalnu franšizu.	1
17	2	19	ako im to ne uspije, dungeons & dragons nastavit će s narativom o prokletstvu, premda su ovaj put došli tako prokleto blizu.	4
17	3	1	ovo je prilično razočaravajuća godina za filmove o superherojima.	2
17	3	2	nakon mješovitih kritika za ant-man and the wasp: quantumania i debakla shazam: fury of the gods u kino blagajnama, čini se da je publika umorna od gomile supermoćnih ljudi koji se udružuju kako bi spasili svijet.	2
17	3	3	ali, bez brige - fantasy roleplay igra sa stolova američkih srednjoškolskih kantina stigla je da spasi stvar.	4
17	3	4	dungeons & dragons: honor among thieves je apsolutna eksplozija, preuzima zabavu iz igre i prilagođava je velikom ekranu na najbolji mogući način.	0
17	3	5	godine 2000. hollywood je neuspješno pokušao prilagoditi igru svojim strašnim dungeons & dragons filmom.	1
17	3	6	zatim su, nakon godina razvojnog pakla, konačno provalili štos.	0
17	3	7	jonathan goldstein i john francis daley, režiseri fantastične komedije game night iz 2018., izabrani su da naprave fantastičnu akcijsko-avanturističku komediju o pljački u duhu guardians of galaxy.	0
17	3	8	filmovi o odrpanoj grupi neprilagođenih ljudi koji se udružuju kako bi spasili dan su sjajni kada su napravljeni kako treba, a ovaj film to radi kako treba.	0
17	3	9	film preuzima formulu blockbustera mcu-a i vraća šarm i srce koje je potrebno ovim filmovima, a istovremeno zadržava klišeje.	0
17	3	10	film nas upoznaje s edginom darvisom, bardom koji pati od sindroma mrtve žene.	4
17	3	11	što bi muški protagonist bio bez djevojke iz svoje prošlosti koju ne može pustiti?	4
17	3	12	udružio se s holgom kilgore, barbarkom koja je uvijek spremna za borbu, a moraju surađivati s nekolicinom drugih kako bi izveli nevjerojatnu pljačku.	1
17	3	13	dungeons and dragons: honor among thieves čista je zabava od početka do kraja, a počinje opsežnim izlaganjem retrospektiva začinjenim s puno blesavosti.	0
17	3	14	njegova je priča strukturirana poput igre dnd s mnogo trenutaka osmišljenih da udovolje dugogodišnjim obožavateljima.	0
17	3	15	međutim, film ima dovoljno zabavne vrijednosti da se dopadne onima koji nisu upoznati s igrom, budući da je riječ o fantastičnom filmu prepunom akcije s inventivnom upotrebom magije i uzbudljivim sekvencama.	0
17	3	16	goldstein i daley preuzimaju dijelove akcije iz svojih prethodnih filmova i idu all-in u ovom, dajući svojim borbama i vratolomijama kinetičku energiju koja odgovara stilu.	0
17	3	17	naravno, pomaže to što imamo zvijezde iz nekih od najvećih akcijskih franšiza na svijetu.	0
17	3	18	u ovom filmu pojavljuju se chris pine, michelle rodriguez i justice smith.	1
17	3	19	svakog je glumca zabavno gledati u njegovim ulogama i svi nude nešto jedinstveno svojim likovima.	0
17	3	20	sophia lillis glumi lik koji se može pretvoriti u bilo koju životinju koju želi, što dovodi do nekih od najzabavnijih dijelova filma, posebno jedne scene u kojoj se transformira mnogo puta u jednom dugom kadru praćenja.	0
17	3	21	regé-jean page dobiva izvrsnu ulogu snažnog akcijskog heroja od kojeg biste očekivali da vodi ovaj film, ali umjesto toga dobivamo pinea kao prizemnijeg svakidašnjeg čovjeka.	3
17	3	22	hugh grant je kradljivac scena u ovom filmu sa svojim urnebesnim tajmingom za komediju.	0
17	3	23	film je trebao sadržavati više njega, jer on čini film boljim svaki put kad se pojavi.	3
17	3	24	iako u dungeons and dragons: honor among thieves nema manjka klišeja unutar fantastične pustolovne drame, ona izvrsno koristi moći svakog lika, što dovodi do uzbudljive, očaravajuće vožnje.	3
17	4	1	edgin darvis bio je član elitne jedinice harfista, koja je branila kontinent faerûn.	1
17	4	2	ali nakon što je odigrao bitnu ulogu u zarobljavanju crvenog maga od thaya, život ovog simpatičnog junaka okrenuo se naglavačke.	1
17	4	3	u znak odmazde, crveni magovi napali su njegov dom, smrtno ranili njegovu ženu i zamalo ubili edginovu kćer.	1
17	4	4	zajedno s barbaricom holgom, mladim čarobnjakom simonom i varalicom forgeom, edgin je postao vješti lopov, a u biznis je uveo i svoju kćer.	1
17	4	5	iako se čini da je edgin prihvatio bezakonje, njegova namjera sve te godine bila je samo jedna – vratiti svoju voljenu ženu među žive.	1
17	4	6	vođen ovim plemenitim ciljem, naš se junak uputio u opasnu avanturu, koja je njegovu družinu odvela u srce edginove stare organizacije – u tajno skrovište harfista.	1
17	4	7	no u trenutku kad se činilo da će edgin konačno ispuniti svoj cilj, sve što je moglo pošlo je u krivo.	1
17	4	8	izdan i napušten, edgin je zajedno s holgom završio u strogo čuvanom zatvoru na kraju svijeta, iz kojeg je skoro nemoguće pobjeći… skoro nemoguće.	1
17	4	9	ako vam se činilo da gore navedeno podsjeća na quest, odnosno njegov početak, niste u krivu.	1
17	4	10	edginova pozadinska priča gotovo je preslika priče lika koji svaki igrač popularne role-playing igre – dungeons and dragons – kreira, prije nego što se sa svojim prijateljima zaputi u fascinantan svijet forgotten realms, fantastični svijet koji je još 1987. godine zamislio ed greenwood.	1
17	4	11	svijet koji unatoč ogromnoj popularnosti među igračima, hollywood nikako nije uspio „prebaciti“ na velike ekrane.	1
17	4	12	ako ste kojim slučajem fan d&d settinga, možete mirno odahnuti.	1
17	4	13	john francis daley i jonathan goldstein, režiseri i scenaristi filma dungeons & dragons: honor among thieves konačno su napravili sve kako treba.	0
17	4	14	a i ako vam se ne da proučavati enciklopedije udaljenih i mističnih područja, ako vam baldur’s gate, icewind dale ili waterdeep ništa ne znače, i ako ne znate pravilno napisati „drizzt“, film će vam se vrlo vjerojatno svidjeti.	0
17	4	15	radnja „honor among thieves“, jednostavna je avantura koja ne zahtjeva imerziju u svijet d&d-a.	1
17	4	16	film na zanimljiv, i nerijetko humorističan način pruža sva potrebna objašnjenja, uključujući priču o glavnom negativcu, i njegov opaki plan.	0
17	4	17	i da, cjelokupno naslijeđe prethodnih filmova s d&d labelom, potpuno je zanemareno u ovoj friškoj adaptaciji.	0
